question;category;correct;incorrect1;incorrect2;incorrect3
Who was the President of the United States during the signing of the Gadsden Purchase?;History;Franklin Pierce;Andrew Johnson;Abraham Lincoln;James Polk
Which car tire manufacturer is famous for its "Eagle" brand of tires, and is the official tire supplier of NASCAR?;Vehicles;Goodyear;Pirelli;Bridgestone;Michelin
What was the #1 selling game on Steam by revenue in 2016?;Entertainment: Video Games;Sid Meier's Civilization VI;Grand Theft Auto V;Counter Strike: Global Offensive;Dark Souls III
What city  has the busiest airport in the world?;Geography;Atlanta, Georgia USA;London, England;Chicago,Illinois ISA;Tokyo,Japan
What is the name of the 8th installment in the Fire Emblem series?;Entertainment: Video Games;The Sacred Stones;Blazing Sword;Awakening;Path of Radiance
Which Hanna-Barbera cartoon character travelled with a canine companion named Beegle Beagle?;Entertainment: Cartoon & Animations;Grape Ape;Boss Gator;Wally Gator;Yogi Bear
Which animation studio animated "Psycho Pass"?;Entertainment: Japanese Anime & Manga;Production I.G;Kyoto Animation;Shaft;Trigger
Who was the inspiration for Cuthbert Calculus in the Tintin series?;Entertainment: Comics;Auguste Picard;Jacques Piccard;Will Morris;J. Cecil Maby
Which company's original slogan was "Don't be evil"?;General Knowledge;Google;Apple;Yahoo;Microsoft
Who is the main villain of the Crash Bandicoot series?;Entertainment: Video Games;Dr. Neo Cortex;Dr. Evo-Cortex;Dr. Cortox;Sir Cartex
In the 1969 Cartoon show "Dastardly and Muttley in Their Flying Machines", which were NOT one of the lyrics in the opening theme?;Entertainment: Cartoon & Animations;Stab him;Nab him;Jab him;Tab him
Which song previously recorded by Elvis Presley was covered by UB40 with a reggae beat?;Entertainment: Music;Can't Help Falling in Love;Jailhouse Rock;In the Ghetto;Wooden Heart
In the indie farming game "Stardew Valley", which NPC hates the "prismatic shard" item when received as a gift?;Entertainment: Video Games;Haley;Abigail ;Elliott;Lewis
"Stadium of Light" is the home stadium for which soccer team?;Sports;Sunderland FC;Barcelona FC;Paris Saints-Germain;Manchester United
Which of these cities does NOT have a United States Minting location?;General Knowledge;St. Louis, MO;San Fransisco, CA;Philidelphia, PA;West Point, NY
Who out of these actresses is the youngest?;Celebrities;Kiernan Shipka;Ariel Winter;Emma Watson;Bonnie Wright
In "JoJo's Bizarre Adventure", which of the following Stands does NOT have a time-based ability?;Entertainment: Japanese Anime & Manga;20th Century Boy;Made in Heaven;Star Platinum;The World
What is the land connecting North America and South America?;Geography;Isthmus of Panama;Isthmus of Suez;Urals;Australasia
Who is a pioneer of "Minimal Music" in 1960s?;Entertainment: Music;Steve Reich;Wolfgang Amadeus Mozart;Brian Eno;Sigur R&oacute;s
Which of the following colors does the Zombie eyes glow in the "Nuketown" map in "Call of Duty: Black Ops II" Zombies mode?;Entertainment: Video Games;Yellow and Blue;Yellow and Red;Red and Blue;Blue and White
How many controllers could a Nintendo GameCube have plugged in at one time?;Entertainment: Video Games;4;8;6;2
How many rivers are in Saudi Arabia?;Geography;0;1;2;3
Where does the original Friday The 13th movie take place?;Entertainment: Film;Camp Crystal Lake;Packanack;Higgins Haven;Camp Forest Green
Which of the following is the IATA code for Manchester Airport?;General Knowledge;MAN;EGLL;LHR;EGCC
Who released the 1991 album "Out of Time"?;Entertainment: Music;R.E.M.;U2;Coldplay;The Rolling Stones
In "Kingdom Hearts", what is the name of Sora's home world?;Entertainment: Video Games;Destiny Islands;Agrabah;Land of Departure;Disney Town
What is the collective noun for rats?;Animals;Mischief;Pack;Race;Drift
How many French Open's did Bj&ouml;rn Borg win?;Sports;6;4;9;2
When did the Crisis of the Third Century begin?;History;235 AD;235 BC;242 AD;210 AD
Which of the following characters is NOT playable in "Resident Evil 6"?;Entertainment: Video Games;Jill Valentine;Chris Redfield;Sherry Birkin;Helena Harper
Which king was killed at the Battle of Bosworth Field in 1485? ;History;Richard III;Edward V;Henry VII;James I
Rhinoplasty is a surgical procedure on what part of the human body?;Science & Nature;Nose;Ears;Chin;Neck
Which type of rock is created by intense heat AND pressure?;Science & Nature;Metamorphic;Sedimentary;Igneous;Diamond
What is the first element on the periodic table?;Science & Nature;Hydrogen;Helium;Oxygen;Lithium
What mineral has the lowest number on the Mohs scale?;Science & Nature;Talc;Quartz;Diamond;Gypsum
Which of the following blood vessels carries deoxygenated blood?;Science & Nature;Pulmonary Artery;Pulmonary Vein;Aorta;Coronary Artery
How many times do you fight Gilgamesh in "Final Fantasy 5"?;Entertainment: Video Games;6;4;5;3
Which Queen song was covered by Brittany Murphy in the 2006 film "Happy Feet"?;Entertainment: Music;Somebody to Love;Under Pressure;Flash;Bohemian Rhapsody
Which of these is NOT a song featured on the Lockjaw EP released in 2013 by Flume &amp; Chet Faker?;Entertainment: Music;Left Alone;What About Us;This Song Is Not About A Girl;Drop The Game
When was the SS or Schutzstaffel established?;History;April 4th, 1925;September 1st, 1941;March 8th, 1935;February 21st, 1926
Who voice acted the character Hiccup in the movie "How to Train Your Dragon"?;Entertainment: Cartoon & Animations;Jay Baruchel;Jack Brauchel;John Powell;Gerard Butler
In Mean Girls, who has breasts that tell when it's raining?;Entertainment: Music;Karen Smith;Gretchen Weiners;Janice Ian;Cady Heron
Against which country did the Dutch Republic fight the Eighty Years' War?;History;Spain;France;England;Portugal
Which one of these songs did the group "Men At Work" NOT make?;Entertainment: Music;Safety Dance;Down Under;Who Can It Be Now?;It's a Mistake
In the "Toaru Majutsu no Index" anime, Touma Kamijou is a level 0 esper that has the ability to do what?;Entertainment: Japanese Anime & Manga;Dispell any esper or magical powers;Teleport;Make telepathic communications;Create electricity from his own body
The new One World Trade Center in Manhattan, New York City was designed by which architect? ;General Knowledge;David Childs;Bjarke Ingels;Michael Arad;Fumihiko Maki
Who patented a steam engine that produced continuous rotary motion?;Science: Gadgets;James Watt;Nikola Tesla;Albert Einstein;Alessandro Volta
How fast is USB 3.1 Gen 2 theoretically?;Science: Computers;10 Gb\/s;5 Gb\/s;8 Gb\/s;1 Gb\/s
In the Portal series of games, who was the founder of Aperture Science?;Entertainment: Video Games;Cave Johnson;GLaDOs;Wallace Breen;Gordon Freeman
Which one of these countries borders with Poland?;Geography;Lithuania;France;Norway;Netherlands
What is not a playable race in "Final Fantasy XIV: A Realm Reborn"?;Entertainment: Video Games;Hume;Miqo'te;Lalafell;Roegadyn
The Who's eponymous line, "Teenage Wasteland", appears in which of their songs?;Entertainment: Music;Baba O' Riley;The Seeker;Won't Get Fooled Again;Pinball Wizard
Which of the following countries has a flag featuring a yellow lion wielding a sword on a dark red background?;Geography;Sri Lanka;Kiribati;Scotland;Bhutan
Who invented the "Spanning Tree Protocol"?;Science: Computers;Radia Perlman;Paul Vixie;Vint Cerf;Michael Roberts
What was the name of the cold-war singer who has a song in Grand Theft Auto IV, and a wall landmark in Moscow for his memorial?;Entertainment: Music;Viktor Tsoi;Jimi Hendrix;Brian Jones;Vladimir Vysotsky
Which programming language shares its name with an island in Indonesia?;Science: Computers;Java;Python;C;Jakarta
When Magic: The Gathering was first solicited, which of the following was it originally titled?;Entertainment: Board Games;Mana Clash;Magic;Magic Clash;Mana Duels
In the game Tom Clancy's Rainbow 6 Siege, what organization is Valkyrie from?;Entertainment: Video Games;Navy Seals;S.A.S;G.I.G.N;F.B.I
In the "Hitman" series, what is the name of the main character?;Entertainment: Video Games;Agent 47;Agent 27;Agent Smith;Agent 67
Which Japanese music group was formed to produce theme music for the anime "Guilty Crown"?;Entertainment: Japanese Anime & Manga;Egoist;Goose house;Babymetal;Garnidelia
The ancient city of Chichén Itz&aacute; was built by which civilization?;History;Mayans;Aztecs;Incas;Toltecs
What is the collective noun for bears?;Animals;Sloth;Drove;Tribe;Husk
In bowling, what is the term used for getting three consecutive strikes?;Sports;Turkey;Flamingo;Birdie;Eagle
Who is the victim mentioned in the second KG-8 incident, in Ace attorney Investigations, Case 4?;Entertainment: Video Games;Deid Mann;Frank Sahwit;Shey De Killer;Raymond Shields
Which of the following player scored a hat-trick during their Manchester United debut?;Sports;Wayne Rooney;Cristiano Ronaldo;Robin Van Persie;David Beckham
In what year was the M1911 pistol designed?;History;1911;1907;1899;1917
Which American family band had a 1986 top 10 hit with the song 'Crush On You'?;Entertainment: Music;The Jets;DeBarge;The Jacksons;The Cover Girls
What was the name of the WWF professional wrestling tag team made up of the wrestlers Ax and Smash?;General Knowledge;Demolition;The Dream Team;The Bushwhackers;The British Bulldogs
What part of an automobile engine uses lobes to open and close intake and exhaust valves, and allows an air\/fuel mixture into the engine?;Vehicles;Camshaft;Piston;Drive shaft;Crankshaft
Which president erased the national debt of the United States?;Politics;Andrew Jackson;Ronald Reagan;John F. Kennedy;Franklin Roosevelt
Which of the following Inuit languages was the FIRST to use a unique writing system not based on the Latin alphabet?;Geography;Inuktitut;Inuinnaqtun;Greenlandic;Inupiat
What is the name of the corgi in Cowboy Bebop?;Entertainment: Japanese Anime & Manga;Einstein;Edward;Rocket;Joel
In the beta version of the 1986 game "The Legend of Zelda", players have the choice between a sword and what other item?;Entertainment: Video Games;Boomerang ;Spear;Slingshot;Crossbow
Winch of these names are not a character of JoJo's Bizarre Adventure?;Entertainment: Japanese Anime & Manga;JoJo Kikasu;Jean-Pierre Polnareff;George Joestar;Risotto Nero
Which of these songs is NOT included in the Suicide Squad OST?;Entertainment: Music;Skies on Fire - AC\/DC;Heathens - Twenty One Pilots;Without Me - Eminem;Fortunate Son - Creedence Clearwater Revival
Which musical artist was NOT featured as playable avatars in the game "DJ Hero"?;Entertainment: Video Games;Dr. Dre;DJ Shadow;Daft Punk;Grandmaster Flash
To the nearest whole number, how many radians are in a whole circle?;Science: Mathematics;6;3;4;5
In an orchestra, what is the lowest member of the brass family?;Entertainment: Music;Tuba;Trombone;Contrabass;Bassoon
What was the first sport to have been played on the moon?;History;Golf;Football;Tennis;Soccer
The 2016 song "Starboy" by Canadian singer The Weeknd features which prominent electronic artist?;Entertainment: Music;Daft Punk;deadmau5;Disclosure;DJ Shadow
In what year was the first "Mass Effect" game released?;Entertainment: Video Games;2007;2008;2009;2010
How many stars are featured on New Zealand's flag?;Geography;4;5;2;0
What was the name of Marilyn Monroe's first husband?;Celebrities;James Dougherty;Joe Dimaggio;Kirk Douglas;Arthur Miller
In what year was "Super Mario Sunshine" released?;Entertainment: Video Games;2002;2003;2000;2004
America Online (AOL) started out as which of these online service providers?;Science: Computers;Quantum Link;CompuServe;Prodigy;GEnie
When was the iPhone released?;Science: Gadgets;2007;2005;2006;2004
Who is the director of the 1991 film "Silence of the Lambs"?;Entertainment: Film;Jonathan Demme;Stanley Kubrick;Frank Darabont;Michael Bay
In what year did the manga "Ping Pong" begin serialization?;Entertainment: Japanese Anime & Manga;1996;2014;2010;2003
How many aces can be shot down through the entirety of "Ace Combat Zero: The Belkan War"?;Entertainment: Video Games;169;100;132;245
What is the name of the planet that the Doctor from television series "Doctor Who" comes from?;Entertainment: Television;Gallifrey;Sontar;Skaro;Mondas
Where did the pineapple plant originate?;General Knowledge;South America;Hawaii;Europe;Asia
Which of the following games was NOT included in Valve's Orange Box?;Entertainment: Video Games;Counter-Strike;Portal;Half-Life 2: Episode Two;Team Fortress 2
In the Halo series, which era of SPARTAN is Master Chief? ;Entertainment: Video Games;SPARTAN-II;SPARTAN-I;SPARTAN-III;SPARTAN-IV
Which boxing personality was one of the presenters in the 1999 revival of It's a Knockout?;Entertainment: Television;Frank Bruno;Henry Cooper;Muhammad Ali;Joe Fraiser
Which scientific unit is named after an Italian nobleman?;Science & Nature;Volt;Pascal;Ohm;Hertz
When someone is cowardly, they are said to have what color belly?;General Knowledge;Yellow;Green;Red;Blue
Which African American is in part responsible for integrating  Major League baseball?;Sports;Jackie Robinson;Curt Flood;Roy Campanella;Satchell Paige
Which portion of the Marijuana plant produces the psychoactive substance known as THC?;Science & Nature;Female Flower;Leaves;Male Flower;Root Ball
Which city is the capital of the United States of America?;Geography;Washington D.C;Seattle;Albany;Los Angeles
Daniel Radcliffe became a global star in the film industry due to his performance in which film franchise?;Entertainment: Film;Harry Potter;Ted;Spy Kids;Pirates of the Caribbean 
Where is the train station "Llanfair&shy;pwllgwyngyll&shy;gogery&shy;chwyrn&shy;drobwll&shy;llan&shy;tysilio&shy;gogo&shy;goch"?;General Knowledge;Wales;Moldova;Czech Republic;Denmark
Which famous book is sub-titled 'The Modern Prometheus'?;Entertainment: Books;Frankenstein;Dracula;The Strange Case of Dr. Jekyll and Mr. Hyde ;The Legend of Sleepy Hollow
What was the name of the hero in the 80s animated video game 'Dragon's Lair'?;Entertainment: Video Games;Dirk the Daring;Arthur;Sir Toby Belch;Guy of Gisbourne
What does a funambulist walk on?;General Knowledge;A Tight Rope;Broken Glass;Balls;The Moon
What historical event was Tchaikovsky's 1812 Overture referencing?;History;The Napoleonic Wars;The American War of 1812;The Russian Revolution;The Charge of the Light Brigade (Crimean War)
How many planets are in our Solar System?;Science & Nature;Eight;Nine;Seven;Ten
Which of these is NOT an Australian state or territory?;Geography;Alberta;New South Wales;Victoria;Queensland
Which of the following car manufacturers had a war named after it?;Vehicles;Toyota;Honda;Ford;Volkswagen
When was "The Gadget", the first nuclear device to be detonated, tested?;History;July 16, 1945;June 22, 1945;August 6, 1945;April 5, 1945
In what Half-Life expansion can you find Gordon's picture in an "Employee of the Month" picture frame?;Entertainment: Video Games;Half-Life: Opposing Force;Half-Life: Blue Shift;Half-Life: Decay;They Hunger
Where and when was the first cardboard box made for industrial use?;History;England, 1817;United States, 1817;England, 1917;United States, 1917
Who is the main character with yellow hair in the anime Naruto?;Entertainment: Japanese Anime & Manga;Naruto;Ten Ten;Sasuke;Kakashi
In Supernatural, what's is Sam's brothers name?;Entertainment: Television;Dean;Dave;Steve;Mike
About how old is Earth?;Science & Nature;4.5 Billion Years;3.5 Billion Years;2.5 Billion Years;5.5 Billion Years
Who serves as the speaker of the prologue in Shakespeare's Romeo and Juliet?;Entertainment: Musicals & Theatres;Chorus;Montague;Refrain;Capulet
In Dota 2, what is Earthshaker's real name?;Entertainment: Video Games;Raigor Stonehoof;Banehallow Ambry;Carl;Barathrum
What is the name of Nissan's most popular electric car?;Vehicles;Leaf;Tree;Deer;Roots
What does the International System of Quantities refer 1024 bytes as?;Science: Computers;Kibibyte;Kylobyte;Kilobyte;Kelobyte
What is the full name of the footballer "Cristiano Ronaldo"?;Sports;Cristiano Ronaldo dos Santos Aveiro;Cristiano Ronaldo los Santos Diego;Cristiano Armando Diego Ronaldo;Cristiano Luis Armando Ronaldo
Sean Bean voices the character of "Martin Septim" in which Elder Scrolls game?;Entertainment: Video Games;The Elder Scrolls IV: Oblivion;The Elder Scrolls V: Skyrim;The Elder Scrolls III: Morrowind ;The Elder Scrolls Online
In "Call Of Duty: Zombies", which map's opening cutscene shows "Richtofen" killing another version of himself?;Entertainment: Video Games;The Giant;Shadows Of Evil;Der Eisendrache;Moon
In Magic: The Gathering, which of the following was the first publicly released foil card?;Entertainment: Board Games;Lightning Dragon;Revenant;Beast of Burden;Dirtcowl Wurm
What vault in the video game "Fallout 3" is the home of multiple clones named Gary?;Entertainment: Video Games;Vault 108;Vault 101;Vault 87;Vault 21
According to the nursery rhyme, what fruit did Little Jack Horner pull out of his Christmas pie?;General Knowledge;Plum;Apple;Peach;Pear
What was the name of Jonny's pet dog in The Adventures of Jonny Quest?;Entertainment: Cartoon & Animations;Bandit;Lucky;Rocky;Max
What is the closest planet to our solar system's sun?;General Knowledge;Mercury;Mars;Jupiter;Earth
The Norse god Odin has two pet crows named "Huginn" and "Muninn".  What do their names mean?;Mythology;Thought &amp; Memory;Power &amp; Peace;War &amp; Learning;Sleeping &amp; Waking
What does "hippopotamus" mean and in what langauge?;Animals;River Horse (Greek);River Horse (Latin);Fat Pig (Greek);Fat Pig (Latin)
Which of the following created and directed the Katamari Damacy series?;Entertainment: Video Games;Keita Takahashi;Hideki Kamiya;Shu Takumi;Shinji Mikami
What French sculptor designed the Statue of Liberty? ;Art;Frédéric Auguste Bartholdi;Jean-Léon Gér&ocirc;me;Auguste Rodin;Henri Matisse
How many members are there in the band Nirvana?;Entertainment: Music;Three;Two;Four;Five
Which member of the Foo Fighters was previously the drummer for Nirvana?;Entertainment: Music;Dave Grohl;Taylor Hawkins;Nate Mendel;Chris Shiflett
Which gas forms about 78% of the Earth&rsquo;s atmosphere?;Science & Nature;Nitrogen;Oxygen;Argon;Carbon Dioxide
Which of the following is NOT classified as a Semetic language?;History;Sumerian;Maltese;Akkadian;Mandaic
The following Spanish provinces are located in the northern area of Spain except:;Geography;Murcia;Asturias;Navarre;Le&oacute;n
Before the 19th Century, the "Living Room" was originally called the...;General Knowledge;Parlor;Open Room;Sitting Room;Loft
Due to the Nagoya Resolution, China agreed to allow Taiwan to compete separately in international sporting events under what name?;Politics;Chinese Taipei;Chinese Taiwan;Republic of Taiwan;Republic of Taipei 
Who is the protagonist of the videogame "Dead Rising 2"?;Entertainment: Video Games;Chuck Greene;Nick Ramos;Frank West;Katie Greene
In the television show Breaking Bad, what is the street name of Walter and Jesse's notorious product?;Entertainment: Television;Blue Sky;Baby Blue;Rock Candy;Pure Glass
Which Pokemon generation did the fan-named "Masuda Method" first appear in? ;Entertainment: Video Games;Diamond\/Pearl;Ruby\/Sapphire;Black\/White;X\/Y
What is the Finnish word for "Finland"?;Geography;Suomi;Eesti;Magyarorsz&aacute;g;Sverige
What team won the 2016 MLS Cup?;Sports;Seattle Sounders;Colorado Rapids;Toronto FC;Montreal Impact
When was the Tamagotchi digital pet released?;Science: Gadgets;1996;1989;1992;1990
Which famous singer was portrayed by actor Kevin Spacey in the 2004 biographical film "Beyond the Sea"?;Entertainment: Film;Bobby Darin;Louis Armstrong;Frank Sinatra;Dean Martin
The book "Fahrenheit 451" was written by whom?;Entertainment: Books;Ray Bradbury;R. L. Stine;Wolfgang Amadeus Mozart;Stephen King
In the game "Hearthstone", what is the best rank possible?;Entertainment: Video Games;Rank 1 Legend;Rank 1 Elite;Rank 1 Master;Rank 1 Supreme
Which rock band released the album "The Bends" in March 1995?;Entertainment: Music;Radiohead;Nirvana;Coldplay;U2
In "Call Of Duty: Zombies", completing which map's main easter egg will reward you with the achievement, "High Maintenance"?;Entertainment: Video Games;Die Rise;Mob Of The Dead;Origins;Ascension
Which of these voices wasn't a choice for the House AI in "The Simpsons Treehouse of Horror" short, House of Whacks?;Entertainment: Television;George Clooney;Matthew Perry;Dennis Miller;Pierce Brosnan
Which company developed and published Game Dev Tycoon?;Entertainment: Video Games;Greenheart Games;Greenland Games;The Tycoonists;MomCorp
In Alice in Wonderland, what is the name of Alice's kitten?;Entertainment: Books;Dinah;Oscar;Heath;Smokey
Which of the following rings from the DC Comics' "Lantern Corps" are classified as Parasitic?;Entertainment: Comics;Indigo (Compassion);Green (Willpower);White (Life);Yellow (Fear)
In the 1968 Cartoon Show "Wacky Races" what was the name of cavemen duo who rode in The Boulder Mobile?;Entertainment: Cartoon & Animations;The Slag Brothers;The Slate Brothers;The Rock Brothers;The Stone Brothers
Which boxer was banned for taking a bite out of Evander Holyfield's ear in 1997?;Sports;Mike Tyson;Roy Jones Jr.;Evander Holyfield;Lennox Lewis
Rick Astley's hit song "Never Gonna Give You Up" was released in what year?;Entertainment: Music;1987;1985;1986;1988
What is the name of the inspector in the series "On the Buses"?;Entertainment: Television;Blakey;Harper;Naily;Gally
How many time zones are in Russia?;Geography;11;8;5;2
Whose 2016 presidential campaign slogan was "Make America Great Again"?;Politics;Donald Trump;Ted Cruz;Marco Rubio;Bernie Sanders
What was the name of the sea witch in the 1989 Disney film "The Little Mermaid"?;Entertainment: Cartoon & Animations;Ursula;Madam Mim;Maleficent;Lady Tremaine
Who is the Pink Floyd song "Shine On You Crazy Diamond" written about?;Entertainment: Music;Syd Barrett;John Lennon;David Gilmour;Floyd
Butters Stotch, Pip Pirrup, and Wendy Testaburger are all characters in which long running animated TV series?;Entertainment: Cartoon & Animations;South Park;The Simpsons;Family Guy;Bob's Burgers
How many Hz does the video standard PAL support?;Science: Computers;50;59;60;25
Who wrote the musical composition, "Rhapsody In Blue"?;Entertainment: Music;George Gershwin;Irving Berlin;Duke Ellington;Johnny Mandel
What was the destination of the missing flight MH370?;General Knowledge;Beijing;Kuala Lumpur;Singapore;Tokyo
What did the first moving picture depict?;Entertainment: Film;A galloping horse;A woman in a dress;A man walking;A crackling fire
What is the name of the stuffed lion in Bleach?;Entertainment: Japanese Anime & Manga;Kon;Jo;Urdiu;Chad
What is the name of the main character in the video game VA-11 HALL-A: Cyberpunk Bartender Action?;Entertainment: Video Games;Jill;Dana;Alma;Anna
In the videogame Bully, what is the protagonist's last name?;Entertainment: Video Games;Hopkins;Smith;Kowalski;Crabblesnitch
The Hagia Sophia was commissioned by which emperor of the Byzantine Empire?;History;Justinian I;Constantine IV;Arcadius;Theodosius the Great
At what temperature does water boil?;Science & Nature;212&deg;F;200&deg;F;181&deg;F;178&deg;F
When did The Beatles release the LP "Please Please Me"?;Entertainment: Music;1963;1970;1960;1969
What city is known as the Rose Capital of the World?;Geography;Tyler, Texas;San Diego, California;Miami, Florida;Anaheim, California
Which day in "Papers, Please" does the man in red appear?;Entertainment: Video Games;Day 23;Day 20;Day 17;Day 15
What is the first track on Kanye West's 808s &amp; Heartbreak?;Entertainment: Music;Say You Will;Welcome to Heartbreak;Street Lights;Heartless
When was Cadillac founded?;Vehicles;1902;1964;1898;1985
Which one of these was not a member of the Fiendish Five in the game Sly Cooper and the Thievius Raccoonus?;Entertainment: Video Games;Dimitri Lousteau;Mz. Ruby;Muggshot;Clockwerk
What is the smallest country in the world?;Geography;Vatican City;Maldives;Monaco;Malta
Earl Grey tea is black tea flavoured with what?;General Knowledge;Bergamot oil;Lavender;Vanilla;Honey
Who provided a majority of the songs and lyrics for "Spirit: Stallion of the Cimarron"?;Entertainment: Film;Bryan Adams;Smash Mouth;Oasis;Air Supply
What is the real name of "Warhead" in the Sega Genesis game "Vectorman"?;Entertainment: Video Games;Raster;Peacehead;Vectorkid;Bitmap
What is the capital of Scotland?;Geography;Edinburgh;Glasgow;Dundee;London
Which country was NOT part of the Soviet Union?;Geography;Romania;Turkmenistan;Belarus;Tajikistan
What date is referenced in the 1971 song "September" by Earth, Wind &amp; Fire?;Entertainment: Music;21st of September;26th of September;23rd of September;24th of September
In "Resident Evil 3", how many inventory slots does Jill have at the start of the game?;General Knowledge;10;6;8;12
What's the name of the main protagonist in the "Legend of Zelda" franchise?;Entertainment: Video Games;Link;Mario;Zelda;Pit
What is the capital of the American state of Arizona?;Geography;Phoenix;Montgomery;Tallahassee;Raleigh
In the Super Mario Bros. Series, what is Yoshi's scientific name?;Entertainment: Video Games;T. Yoshisaur Munchakoopas;Yoshi;T. Yoshisotop Munchakoopas;Yossy
Who wrote the 1967 horror novel "Rosemary's Baby"?;Entertainment: Books;Ira Levin;Stephen King;Robert Bloch;Mary Shelley
How many degrees Fahrenheit is 100 degrees Celsius? ;Science & Nature;212;326;100;451
What is the world's oldest board game?;Entertainment: Board Games;Senet;Chess;Checkers;Go
Which country is completely landlocked by South Africa?;Geography;Lesotho;Swaziland;Botswana;Zimbabwe
What is the first Mersenne prime exponent over 1000?;Science: Mathematics;1279;2203;1009;1069
Who was the first female protagonist in a video game?;Entertainment: Video Games;Samus Aran;Lara Croft;Alis Landale;Chell
