question;category;correct;incorrect1;incorrect2;incorrect3
Which of the following Call of Duty games was a PS3 launch title?;Entertainment: Video Games;Call of Duty 3;Call of Duty 4: Modern Warfare;Call of Duty: World at War;Call of Duty: Roads to Victory
Which actor from The Young Ones also played Lord Flashheart in one episode of Blackadder II?;Entertainment: Television;Rik Mayall;Adrian Edmondson;Nigel Planer;Christopher Ryan
Which of these cities is NOT in England?;Geography;Edinburgh;Oxford;Manchester;Southampton
Which Final Fantasy game consisted of a female-only cast of party members?;Entertainment: Video Games;Final Fantasy X-2;Final Fantasy IX;Final Fantasy V;Final Fantasy XIII-2
In the 2000 video game "Crimson Skies," what was the name of the protagonists' zeppelin?;Entertainment: Video Games;Pandora;Helios;Icarus;Orion
Which of the following language families is the most controversial amongst modern linguists?;Geography;Altaic;Sino-Tibetan;Dravidian;Indo-European
Which of the following films was Don Bluth both the writer, director, and producer for?;Entertainment: Cartoon & Animations;All Dogs Go To Heaven;Titan A.E.;Anastasia;The Land Before Time
Which souls game was not directed by Hidetaka Miyazaki?;Entertainment: Video Games;Dark Souls 2;Demon Souls;Dark Souls;Dark Souls 3
The manga JoJo's Bizarre Adventure is split into how many parts?;Entertainment: Japanese Anime & Manga;8;6;4;3
Which album was released by Kanye West in 2013?;Entertainment: Music;Yeezus;My Beautiful Dark Twisted Fantasy;The Life of Pablo;Watch the Throne
Which class of animals are newts members of?;Animals;Amphibian;Fish;Reptiles;Mammals
Which Las Vegas casino was originally constructed and operated by mobster Bugsy Siegel?;History;The Flamingo;The MGM Grand;The Sands;The Sahara
According to Fair Works Australia, how long do you have to work to get Long Service Leave?;General Knowledge;7 years;2 years;8 years;6 months
What is former United States President Bill Clinton's full name?;Politics;William Jefferson Clinton;William Roosevelt Clinton;William Truman Clinton;William Lincoln Clinton
What Queen song plays during the final fight scene of the film "Hardcore Henry"?;Entertainment: Film;Don't Stop Me Now;Brighton Rock;Another Bites the Dust;We Will Rock You
In the "Portal" series, who was Cave Johnson's personal assistant?;Entertainment: Video Games;Caroline;Heather;Melissa;Jane
What are Sans and Papyrus named after in "Undertale"?;Entertainment: Video Games;Fonts;Plants;Companies;Ancient writing paper
Who won the premier league title in the 2015-2016 season following a fairy tale run?;Sports;Leicester City;Tottenham Hotspur;Watford;Stoke City
Out of all of the NASA Space Shuttles, which 2 have been destroyed in disasters?;Science: Gadgets;Challenger and Columbia;Enterprise and Atlantis;Discovery and Endeavour;None of the Above
What is the colour of unoxidized blood?;Science & Nature;Red;Blue;Purple;Green
Where was the Sniper character in Team Fortress 2 born?;Entertainment: Video Games;New Zealand;South Africa;Antarctica;Australia
What is the scientific name of the knee cap?;Science & Nature;Patella;Femur;Foramen Magnum;Scapula
Joseph Stalin had a criminal past doing what?;History;Robbing trains;Pedophilia;Tax evation;Identity Fraud
Which American-owned brewery led the country in sales by volume in 2015?;General Knowledge;D. G. Yuengling and Son, Inc;Anheuser Busch;Boston Beer Company;Miller Coors
Who is the main protagonist of "Ace Combat Zero: The Belkan War"?;Entertainment: Video Games;Cipher;Mobius 1;Blaze;Pixy
When was the "Siege of Leningrad" lifted during World War II?;History;January 1944;September 1943;November 1943;March 1944
What was the name of the inflatable duck sacrified to the crowd at the end of Episode 34 of the 18th season of Big Brother?;Entertainment: Television;Pablo;Esteban;Carlos;Duckster
What is Solid Snake's real name?;Entertainment: Video Games;David;Solid Snake;John;Huey
Which of these bones is hardest to break?;Science & Nature;Femur;Cranium;Humerus;Tibia
The painting "The Starry Night" by Vincent van Gogh was part of which art movement?;Art;Post-Impressionism;Romanticism;Neoclassical;Impressionism
In the 2014 film "Birdman", what is the primary instrument in the score?;Entertainment: Film;Drums;Saxophone;Violin;Actual Live Birds Singing
Which UK country features a dragon on their flag?;Geography;Wales;England;North Ireland;Scotland
What is the name of the villian in the 2015 Russian-American Sci-Fi Movie "Hardcore Henry"?;Entertainment: Film;Akan;Estelle;Jimmy;Henry
What is a dead mall?;General Knowledge;A mall with high vacancy rates or low consumer foot traffic;A mall with no stores;A mall that has been condemed;A mall after business hours
In the 2016 Global Peace Index poll, out of 163 countries, what was the United States of America ranked?;Geography;103;10;59;79
Which of these characters from "SpongeBob SquarePants" is not a squid?;Entertainment: Cartoon & Animations;Gary;Orvillie;Squidward;Squidette
What is the unit of electrical inductance?;Science & Nature;Henry;Weber;Coulomb;Mho
Which gaming series includes "The Diabolical Box" and "The Curious Village"?;Entertainment: Video Games;Professor Layton;Persona;Etrian Odyssey;Sam &amp; Max
Which small country is located between the borders of France and Spain?;Geography;Andorra;San Marino;Vatican City;Lichtenstein
Which sci-fi cult films plot concerns aliens attempting to prevent humans from creating a doomsday weapon?;Entertainment: Film;Plan 9 from Outer Space;The Man from Planet X;It Came from Outer Space;The Day The Earth Stood Still
What year did the television company BBC officially launch the channel BBC One?;Entertainment: Television;1936;1948;1932;1955
What geometric shape is generally used for stop signs?;General Knowledge;Octagon;Hexagon;Circle;Triangle
What African country has Portuguese as its official language?;Geography;Mozambique;Botswana;Gabon;Togo
On which day did construction start on "The Pentagon", the headquarters for the United States Department of Defense?;History;September 11, 1941;June 15, 1947;January 15, 1943;September 2, 1962
What year was the Mona Lisa finished?;Art;1504;1487;1523;1511
In the 1993 Disney animated series "Bonkers", what is the name of Bonker's second partner?;Entertainment: Cartoon & Animations;Miranda Wright;Dick Tracy;Eddie Valiant;Dr. Ludwig von Drake
In Greek mythology, who is the god of wine?;Mythology;Dionysus;Hephaestus;Demeter;Apollo
What is the name of the Greek god of blacksmiths?;Mythology;Hephaestus;Dyntos;Vulcan;Artagatus
At the end of the 2001 film "Rat Race", whose concert do the contestants crash?;Entertainment: Film;Smash Mouth;Bowling for Soup;Sum 41;Linkin Park
Which portuguese island is soccer player Cristiano Ronaldo from?;Sports;Madeira;Terceira;Santa Maria;Porto Santo
What is a Burgee?;General Knowledge;A flag;A rope;A window;A type of food
What was the name of the hip hop group Kanye West was a member of in the late 90s?;Entertainment: Music;The Go-Getters;The Jumpers;The Kickstarters;The Beat-Busters
Which lyric is about Red Hot Chili Peppers frontman Anthony Kiedis?;Entertainment: Music;"A rainy Lithuanian \/ Is dancing as an Indian";"Fly away on, my zephyr \/ I feel it more than ever";"And I liked the dimple in your chin \/ Your pale blue eyes";"You used to be so warm and affectionate...but now you're quick to get into your regret"
Which of the following is NOT a Nintendo game console?;Entertainment: Video Games;Dreamcast;SNES;Wii;Switch
Which of these countries is "doubly landlocked" (surrounded entirely by one or more landlocked countries)?;Geography;Uzbekistan;Switzerland;Bolivia;Ethiopia
Which of the following languages is used as a scripting language in the Unity 3D game engine?;Science: Computers;C#;Java;C++;Objective-C
What is the capital of Denmark?;Geography;Copenhagen;Aarhus;Odense;Aalborg
Johnny Cash did a cover of this song written by lead singer of Nine Inch Nails, Trent Reznor.;Entertainment: Music;Hurt;Closer;A Warm Place;Big Man with a Gun
What is Grumpy Cat's real name?;Animals;Tardar Sauce;Sauce;Minnie;Broccoli
What is the name of the main character from the music video of "Shelter" by Porter Robinson and A-1 Studios?;Entertainment: Music;Rin;Rem;Ren;Ram
What is the last song on the first Panic! At the Disco album?;Entertainment: Music;Build God, Then We'll Talk;Nails for Breakfast, Tacks for Snacks;I Write Sins Not Tragedies;Lying Is The Most Fun A Girl Can Have Without Taking Her Clothes Off
How many copies have Metallica album "Metallica" (A.K.A The Black Album) sold worldwide (in Millions of Copies)?;Entertainment: Music;20.5;19.5;22.5;25.5
In the game "Red Dead Redemption", what is the name of John Marston's dog?;Entertainment: Video Games;Rufus;Rutus;Finn;Apollo
Which member of "The Beatles" narrated episodes of "Thomas the Tank Engine"?;Entertainment: Music;Ringo Starr;George Harrison;John Lennon;Paul McCartney
The minigun was designed in 1960 by which manufacturer.;History;General Electric;Colt Firearms;Heckler &amp; Koch;Sig Sauer
Bj&ouml;rk's "Unison" contains a sample of which Oval song?;Entertainment: Music;Aero Deck;Textuell;Panorama;Do While
In which series of games do you collect souls to empower you and buy weaponry and armor with?;Entertainment: Video Games;Souls ;Final Fantasy ;Monster Hunter;The Legend of Zelda
In the 1984 movie "The Terminator", what model number is the Terminator portrayed by Arnold Schwarzenegger?;Entertainment: Film;T-800;I-950;T-888;T-1000
Along with Gabe Newell, who co-founded Valve?;Entertainment: Video Games;Mike Harrington;Robin Walker;Marc Laidlaw;Stephen Bahl
In "Fairy Tail", what is the nickname of Natsu Dragneel?;Entertainment: Japanese Anime & Manga;The Salamander;The Dragon Slayer;The Dragon;The Demon
Which of the following buildings is example of a structure primarily built in the Art Deco architectural style?;General Knowledge;Niagara Mohawk Building;Taipei 101;One Detroit Center;Westendstrasse 1
Which of these characters is the mascot of the video game company SEGA?;Entertainment: Video Games;Sonic the Hedgehog;Dynamite Headdy;Alex Kidd;Opa-Opa
In programming, the ternary operator is mostly defined with what symbol(s)?;Science: Computers;?:;??;if then;?
In Halo 2, how many rounds does the M6C hold in a single magazine?;Entertainment: Video Games;12;6;36;18
In the game "Persona 4", what is the canonical name of the protagonist?;Entertainment: Video Games;Yu Narukami;Chino Mashido;Tunki Sunada;Masaki Narinaka
Which of the following is not a Flintstones character?;Entertainment: Cartoon & Animations;Lord Rockingham IX;Rockhead Slate;The Great Gazoo;Barney Rubble
According to "Star Wars" lore, which planet does Obi-Wan Kenobi come from?;Entertainment: Film;Stewjon;Alderaan;Tatooine;Naboo
Electronic artists Boys Noize and Skrillex have collaborated and released tracks under what name?;Entertainment: Music;Dog Blood;Jack &Uuml;;What So Not;Noisia
In the book series "Odd Thomas", Danny Jessup has what genetic disease? ;Entertainment: Books; Osteogenesis Imperfecta;Spinocerebellar ataxia;Adrenoleukodystrophy;Cystic Fibrosis
In 1845, a series of wars named after which indigenous people began in New Zealand?;History;M\u0101ori;Papuans;Aborigines;Polynesians
In board games, an additional or ammended rule that applies to a certain group or place is informally known as a "what" rule?;Entertainment: Board Games;House;Custom;Extra;Change
When was Elvis Presley born?;Celebrities;January 8, 1935;December 13, 1931;July 18, 1940;April 17, 1938
Mirror's Edge Catalyst takes place in the City of...?;Entertainment: Video Games;Glass;Mirrors;Purity;Diamonds
What is the correct spelling of the protagonist of the book in The NeverEnding Story (1984)?;Entertainment: Film;Atreyu;Atrayu;Atraiyu;Atraeyu
In the movie "Blade Runner", what is the term used for human-like androids ?;Entertainment: Film;Replicants;Cylons;Synthetics;Skinjobs
The 'In the Flesh' tour was used in support of what Pink Floyd album?;Entertainment: Music;Animals;The Wall;Wish You Were Here;The Final Cut
Who is the lead singer of the Smashing Pumpkins?;Entertainment: Music;Billy Corgan;Brett Scallions;Eddie Vedder;Chino Moreno
What was the name of the teenage witch played by Melisa Joan Hart who lives with her witch aunts Hilda and Zelda?;Entertainment: Television;Sabrina;Hermione;Dorothy;Dahlia
Which punk rock band released hit songs such as "Californication", "Can't Stop" and "Under the Bridge"?;Entertainment: Music;Red Hot Chilli Peppers;Green Day;Linkin Park;Foo Fighters
Which genre is the Touhou Project associated with?;Entertainment: Video Games;Shoot 'em up (bullet-hell) &amp; Fighting;Turn-Based Strategy;MMORPG;Building 
Who is Manchester United's leading appearance maker?;Sports;Ryan Giggs;David Beckham;Wayne Rooney;Eric Cantona
Which animal features on the logo for Abarth, the motorsport division of Fiat?;Vehicles;Scorpion;Snake;Bull;Horse
In the original Doctor Who series (1963), fourth doctor Tom Baker's scarf was how long?;Entertainment: Television;7 Meters;10 Meters;2 Meters;5 Meters
When was Final Fantasy XV released?;Entertainment: Video Games;November 29th, 2016;October 25th, 2016;December 31th, 2016;November 30th, 2016
What is the name of the Canadian national anthem?;Geography;O Canada;O Red Maple;Leaf-Spangled Banner;March of the Puck Drop
What block in Minecraft has the highest blast resistance?;Entertainment: Video Games;Barrier;Obsidian;Bedrock;Block of Diamond
What is the name of the common, gun-toting enemies of the "Oddworld" video game series?;Entertainment: Video Games;Sligs;Scrabs;Slogs;Glukkons
How many unique items does "Borderlands 2" claim to have?;Entertainment: Video Games;87 Bazillion ;87 Million;87 Trillion;87 Gazillion 
What is the name of the main antagonists in Battlestar Galactica?;Entertainment: Television;The Cylons;The Collective;The Federation;The Rebels
Which boxer was famous for striking the gong in the introduction to J. Arthur Rank films?;Entertainment: Film;Bombardier Billy Wells;Freddie Mills;Terry Spinks;Don Cockell
Which Marvel superhero did Chris Evans play prior to his role as Captain America?;Entertainment: Film;Human Torch;Cyclops;Iceman;Daredevil
What was the name of the Ethiopian Wolf before they knew it was related to wolves?;Animals;Simien Jackel;Ethiopian Coyote;Amharic Fox;Canis Simiensis
The Tsar Bomba, the most powerful nuclear bomb ever tested, had a yield of 50 megatons but theoretically had a maximum yield of how much?;History;100 Megatons;200 Megatons;75 Megatons;150 Megatons
A stimpmeter measures the speed of a ball over what surface?;Sports;Golf Putting Green; Football Pitch;Cricket Outfield;Pinball Table
In which Shakespearean play will you find the suicide of Ophelia?;Entertainment: Musicals & Theatres;Hamlet;Macbeth;Othello;King Lear
Which of these is the name of an American psychedelic rock band formed in 2002 by Benjamin Goldwasser and Andrew VanWyngarden?;Entertainment: Music;MGMT;MSTRKRFT;STRFKR;SBTRKT
What is the name of the main character in the webcomic Gunnerkrigg Court by Tom Siddell?;Entertainment: Comics;Antimony;Bismuth;Mercury;Cobalt
What is the largest lake in the African continent?;Geography;Lake Victoria;Lake Tanganyika;Lake Malawi;Lake Turkana
Which of the following is NOT a real element?;Science & Nature;Vitrainium;Praseodymium;Hassium;Lutetium
What's the Team Fortress 2 Scout's city of origin?;Entertainment: Video Games;Boston;Sydney;Detroit;New York
Which of these is NOT a playable character in "Left 4 Dead"?;Entertainment: Video Games;Nick;Louis;Zoey;Bill
What ingredients are required to make a cake in Minecraft?;Entertainment: Video Games;Milk, Sugar, Egg, and Wheat;Milk, Bread, Egg, and Wheat;Milk, Sugar Cane, Egg, and Wheat;Milk, Sugar, and Wheat
In what year was the game "FTL: Faster Than Light" released?;Entertainment: Video Games;2012;2014;2013;2011
What was the unofficial name for Germany between 1919 and 1933?;History;Weimar Republic;German Democratic Republic;Federal Republic of Germany;Oesterreich 
Pamina and Papageno are characters in what Mozart opera?;Entertainment: Music;The Magic Flute;The Marriage of Figaro;The Impresario;The Goose of Cairo
What tool lends it's name to a last-stone advantage in an end in Curling?;Sports;Hammer;Wrench;Drill;Screwdriver
What does the letter 'S' stand for in 'NASA'?;Science & Nature;Space;Science;Society;Star
In the video-game franchise Kingdom Hearts, the main protagonist, carries a weapon with what shape?;General Knowledge;Key;Sword;Pen;Cellphone
What is the capital of Chile?;Geography;Santiago;Valpara&iacute;so;Copiap&oacute;;Antofagasta
What does the 'S' stand for in the abbreviation SIM, as in SIM card? ;General Knowledge;Subscriber;Single;Secure;Solid
What country is Cory in the House set in?;Entertainment: Television;The United States of America;Canada;Venezuala;England
J.K. Rowling completed "Harry Potter and the Deathly Hallows" in which hotel in Edinburgh, Scotland?;Entertainment: Books;The Balmoral;The Dunstane Hotel;Hotel Novotel;Sheraton Grand Hotel &amp; Spa
In the movie "Scream" who is Ghost Face?;Entertainment: Film;Billy Loomis and Stu Macher;Dewey Riley;Sidney Prescott;Archie Prescott and Philip Marv
This album, now considered to be one of the greatest of all time, was a commercial failure when it was released.;Entertainment: Music;The Velvet Underground and Nico;Abbey Road;Led Zeppelin IV;Pet Sounds
Which of these is not a key value of Agile software development?;Science: Computers;Comprehensive documentation;Individuals and interactions;Customer collaboration;Responding to change
Which game in the "Monster Hunter" series introduced the monster "Gobul"?;Entertainment: Video Games;Monster Hunter Tri;Monster Hunter Freedom Unite;Monster Hunter Frontier;Monster Hunter Generations
What is the name of the creature that the main character befriends in "The Last Guardian"?;Entertainment: Video Games;Trico;Nico;Wolf;Andazi
In season one of the US Kitchen Nightmares, Gordan Ramsay tried to save 10 different restaurants. How many ended up closing afterwards?;Entertainment: Television;9;6;3;0
Who led the Communist Revolution of Russia?;History;Vladimir Lenin;Joseph Stalin;Vladimir Putin;Mikhail Gorbachev
In 2012 the German-speaking microstate "Liechtenstein" in Central Europe had a population of how many inhabitants?;Geography;36,600;2,400;90,000;323,400
What did the first vending machines in the early 1880's dispense?;History;Post cards;Alcohol;Cigarettes;Sodas 
On Twitter, what is the character limit for a Tweet?;Science: Computers;140;120;160;100
Which car tire manufacturer is famous for its "P Zero" line?;Vehicles;Pirelli;Goodyear;Bridgestone;Michelin
Which studio animated Afro Samurai?;Entertainment: Japanese Anime & Manga;Gonzo;Kyoto Animation;xebec;Production I.G
The musical "Dirty Rotten Scoundrels" is set in what country?;Entertainment: Musicals & Theatres;France;USA;Germany;Sweden
When was the FC Schalke 04 founded?;Sports;1904;1909;2008;1999
The Queen song `A Kind Of Magic` is featured in which 1986 film?;Entertainment: Film;Highlander;Flash Gordon;Labyrinth;Howard the Duck
What device allows Tracer to manipulate her own time in the game "Overwatch"?;Entertainment: Video Games;Chronal Accelerator;B.L.I.N.K;Spacial Displacement Manipulator;TMD (Time Manipulation Device)
What year was the game "Overwatch" revealed?;Entertainment: Video Games;2014;2015;2011;2008
What is the name of the three headed dog in Harry Potter and the Sorcerer's Stone?;Entertainment: Books;Fluffy;Spike;Poofy;Spot
What is the name of Poland in Polish?;General Knowledge;Polska;Pupcia;Polszka;P&oacute;land
What does the term "isolation" refer to in microbiology?;Science & Nature;The separation of a strain from a natural, mixed population of living microbes;A lack of nutrition in microenviroments;The nitrogen level in soil;Testing effects of certain microorganisms in an isolated enviroments, such as caves
In "Star Trek", what is the Ferengi's First Rule of Acquisition?;Entertainment: Television;Once you have their money, you never give it back. ;Never place friendship above profit;Greed is Eternal;Never allow family to stand in the way of opportunity
In the "Sailor Moon" series, what is Sailor Jupiter's civilian name?;Entertainment: Japanese Anime & Manga;Makoto Kino;Minako Aino;Usagi Tsukino;Rei Hino
In "Toriko", which of the following foods is knowingly compatible with Toriko?;Entertainment: Japanese Anime & Manga;Poison Potato;Mors Oil;Alpacookie;Parmesansho Fruit
In Mulan (1998), who is the leader of the Huns?;Entertainment: Film;Shan Yu;Chien-Po;Li Shang;Fa Zhou
When was the Grand Patriotic War in the USSR concluded?;History;May 9th, 1945;September 2nd, 1945;August 9th, 1945;December 11th, 1945
What car manufacturer gave away their patent for the seat-belt in the interest of saving lives?;Vehicles;Volvo;Ferrari;Ford;Renault
According to DeMorgan's Theorem, the Boolean expression (AB)' is equivalent to:;Science: Computers;A' + B';A'B + B'A;A'B';AB' + AB
What is the full title of the Prime Minister of the UK?;General Knowledge;First Lord of the Treasury;Duke of Cambridge;Her Majesty's Loyal Opposition;Manager of the Crown Estate
In the show "Dragonball Z", what is the name of Cell's most powerful attack?;Entertainment: Television;Solar Kamehameha;Super Kamehameha;Cell Kamehameha;Android Kamehameha
What is the real name of the "Master Of Magnetism" Magneto?;Entertainment: Comics;Max Eisenhardt;Charles Xavier;Pietro Maximoff;Johann Schmidt
The song 'Little April Shower' features in which Disney cartoon film?;Entertainment: Cartoon & Animations;Bambi;Cinderella;Pinocchio;The Jungle Book
What is the main ship used by Commander Shepard in the Mass Effect Franchise called?;Entertainment: Video Games;Normandy;Osiris;Infinity;Endeavour
How many time zones does China have?;Geography;1;3;4;2
Which of these is NOT a playable character in the 2016 video game Overwatch?;Entertainment: Video Games;Invoker;Mercy;Winston;Zenyatta
The creator of the Touhou Project series is:;Entertainment: Video Games;ZUN;SUN;RUN;PUN
The asteroid belt is located between which two planets?;Science & Nature;Mars and Jupiter;Jupiter and Saturn;Mercury and Venus;Earth and Mars
In Cook, Serve, Delicious!, which food is NOT included in the game?;Entertainment: Video Games;Pie;Shish Kabob;Hamburger;Lasagna
Aubrey Graham is better known as;Celebrities;Drake;Travis Scott;Lil Wayne;2 Chainz
Which team won the "Tom Clancy's Rainbow Six Siege" Invitational Event February 2017 in the PC Category?;Entertainment: Video Games;Continuum;GIFU;Santos Dexterity;eRa Eternity
How many seasons did the TV show "Donkey Kong Country" last?;Entertainment: Television;2;1;4;5
In "Overwatch", how much health does Roadhog's "Take a Breather" ability recover?;Entertainment: Video Games;300;100;200;400
What is the name of the main protagonist in "Xenoblade Chronicles"?;Entertainment: Video Games;Shulk;Reyn;Fiora;Dunban
Which of the following Mario Kart 8 Deluxe items will NOT make you invincible?;Entertainment: Video Games;Golden Mushroom;Star;Bullet Bill;Boo
Which painting was not made by Vincent Van Gogh?;Art;The Ninth Wave;Café Terrace at Night;Bedroom In Arles;Starry Night
If you are caught "Goldbricking", what are you doing wrong?;General Knowledge;Slacking;Smoking;Stealing;Cheating
Who directed the movies "Pulp Fiction", "Reservoir Dogs" and "Django Unchained"?;Entertainment: Film;Quentin Tarantino;Martin Scorcese;Steven Spielberg;James Cameron
The theme for the popular science fiction series "Doctor Who" was composed by who?;Entertainment: Television;Ron Grainer;Murray Gold;Delia Derbyshire;Peter Howell
What is the romanized Russian word for "winter"?;General Knowledge;Zima;Leto;Vesna;Osen'
If you play the Super Mario RPG and nap in a rented hotel room, you will wake up next to what familiar looking character?;Entertainment: Video Games;Link;Wario;Q*bert;Solid Snake
In Pre-Super Genesis universe of "Sonic the Hedgehog" comic, what was the name of  Sally Acorn's brother?;Entertainment: Comics;Elias Acorn;Maximillian Acorn;Alexis Acorn;Frederick Acorn
Which of the following was NOT a playable character in the game Kingdom Hearts: Birth by Sleep?;Entertainment: Video Games;Ignis;Ventus;Terra;Aqua
How long was Ken Jennings' win streak on Jeopardy?;Entertainment: Television;74;88;49;62
In "Breaking Bad", Walter White is a high school teacher diagnosed with which form of cancer?;Entertainment: Television;Lung Cancer;Prostate Cancer;Brain Cancer;Testicular Cancer
When Donkey Kong died in the "Donkey Kong Country" episode "It's a Wonderful Life", who was his guardian angel?;Entertainment: Television;Eddie the Mean Old Yeti;Kiddy Kong;Diddy Kong;King K. Rool
Which of the following countries was the first to send an object into space?;History;Germany;USA;Russia;China
Which of these stages is not playable in "Super Smash Bros. for Wii U"?;Entertainment: Video Games;Fountain of Dreams;Bridge of Eldin;75m;Miiverse
What is Dipper's real name from "Gravity Falls"?;Entertainment: Cartoon & Animations;Mason Pines;Mable Pines;Jason Pines;Mark Pines
Whose greyscale face is on the kappa emoticon on Twitch?;General Knowledge;Josh DeSeno;Justin DeSeno;John DeSeno;Jimmy DeSeno
What are the names of the Ice Climbers in the video game Ice Climber?;Entertainment: Video Games;Popo and Nana;Popo and Nina;Papi and Nana;Papi and Nina
In computing, what does MIDI stand for?;Science: Computers;Musical Instrument Digital Interface;Musical Interface of Digital Instruments;Modular Interface of Digital Instruments;Musical Instrument Data Interface
What is the world's most expensive spice by weight?;General Knowledge;Saffron;Cinnamon;Cardamom;Vanilla
By what name was the author Eric Blair better known?;Entertainment: Books;George Orwell;Aldous Huxley;Ernest Hemingway;Ray Bradbury
