question;category;correct;incorrect1;incorrect2;incorrect3
In the game "Terraria", which of these bosses are pre-hardmode bosses?;Entertainment: Video Games;Eye of Cthulhu;Plantera;Skeletron Prime;The Destroyer
In what film was the Michael Jackson song "Will You Be There" featured?;Entertainment: Music;Free Willy;Sleepless in Seattle;Men in Black;Bad Boys
What is the same in Celsius and Fahrenheit?;Science & Nature;-40;32;-39;-42
What was the first Call of Duty game to include the Zombies gamemode?;Entertainment: Video Games;Call of Duty: World at War;Call of Duty: Black Ops;Call of Duty: Modern Warfare 2;Call of Duty: Black Ops III
In "Star Trek", what sauce is commonly used by Klingons on bregit lung?;Entertainment: Television;Grapok sauce;Gazorpazorp pudding;Sweet chili sauce;Grapork sauce
Which studio animated Soul Eater?;Entertainment: Japanese Anime & Manga;Bones;Kyoto Animation;xebec;Production I.G
Who designed the Chupa Chups logo?;Art;Salvador Dali;Pablo Picasso;Andy Warhol;Vincent van Gogh
Which 90's comedy cult classic features cameos appearances from Meat Loaf, Alice Cooper and Chris Farley?;Entertainment: Film;Wayne's World;Bill &amp; Ted's Excellent Adventure;Dumb and Dumber;Austin Powers: International Man of Mystery
What is the capital of Wisconsin, USA?;Geography;Madison;Milwaukee;Wisconsin Dells;Green Bay
In the game "Fire Emblem: Shadow Dragon", what is the central protagonist's name?;Entertainment: Video Games;Marth;Roy;Eliwood;Robin
In a complete graph G, which has 12 vertices, how many edges are there?;Science: Mathematics;66;67;34;11
Who is the villain company in "Stardew Valley"?;Entertainment: Video Games;Joja Co ;Ronin;Empire;Robotnik Industry's 
In which city did American rap producer DJ Khaled originate from?;Entertainment: Music;Miami;New York;Detroit;Atlanta
If you planted the seeds of Quercus robur what would grow?;Science & Nature;Trees;Flowers;Vegtables;Grains
What is the area of Vatican City?;Geography;0.44km^2;0.10km^2;0.86km^2;12.00km^2
How many normal endings are there in Cry Of Fear's campaign mode?;Entertainment: Video Games;4;5;3;6
How many times do you fight the Imprisoned in The Legend of Zelda: Skyward Sword?;Entertainment: Video Games;3;2;4;5
What year was the United States Declaration of Independence signed?;History;1776;1775;1774;1777
What album did The Lumineers release in 2016?;Entertainment: Music;Cleopatra;Winter;The Lumineers;Tracks From The Attic
Which radio personality calls himself "The King of All Media"?;Celebrities;Howard Stern;Rush Limbaugh;Pete Tong;Ryan Seacrest
What year did World War I begin?;History;1914;1905;1919;1925
What machine element is located in the center of fidget spinners?;General Knowledge;Bearings;Axles;Gears;Belts
Which Crypt of the NecroDancer (2015) character has a soundtrack by Jake "Virt" Kaufman?;Entertainment: Video Games;Uncle Eli;Cadence;Nocturna;Octavian (Bard)
In World of Warcraft, which raid instance features a chess event?;Entertainment: Video Games;Karazhan;Zul'Aman;Blackwing Lair;Temple of Ahn'Qiraj
What is the last name of the primary female protagonist of Final Fantasy VIII?;Entertainment: Video Games;Heartilly;Loire;Almasy;Trepe
In programming, what do you call functions with the same name but different implementations?;Science: Computers;Overloading;Overriding;Abstracting;Inheriting
In the "Pikmin" series, what is the only pikmin type to possess visible ears?;Entertainment: Video Games;Yellow;Red;White;Winged
What nationality was the surrealist painter Salvador Dali?;Art;Spanish;Italian;French;Portuguese
Who directed the 1973 film "American Graffiti"?;Entertainment: Film;George Lucas;Ron Howard;Francis Ford Coppola;Steven Spielberg
In Left 4 Dead, what is the character Bill's last name?;Entertainment: Video Games;Overbeck;Fish;Roberts;Stevenson
Which of the following Autobot names in Michael Bay's movies was NOT a name for a Transformer in the original 1980's cartoon?;Entertainment: Television;Mudflap;Skids;Sideswipe;Ratchet
Excluding their instructor, how many members of Class VII are there in the game "Legend of Heroes: Trails of Cold Steel"?;Entertainment: Video Games;9;6;10;3
Which of these is NOT a team available in the game Pokémon Go?;Entertainment: Video Games;Team Rocket;Team Instinct;Team Valor;Team Mystic
How many colors are there in a rainbow?;General Knowledge;7;8;9;10
What name was historically used for the Turkish city currently known as Istanbul?;Geography;Constaninople;H&uuml;davendigar;S&ouml;\u011f&uuml;t;Adrianople
Which puzzle game was designed by a Russian programmer, featuring Russian buildings and music?;Entertainment: Video Games;Tetris;Jenga;Boulder Dash;Puzzled
In the 1994 movie "Speed", what is the minimum speed the bus must go to prevent to bomb from exploding?;Entertainment: Film;50 mph;60 mph;40 mph;70 mph
Where are the Nazca Lines located?;Geography;Peru;Brazil;Colombia;Ecuador
Which of these colours is NOT featured in the logo for Google?;General Knowledge;Pink;Yellow;Blue;Green
Which of these is a type of stretch\/deep tendon reflex?;Science & Nature;Ankle jerk reflex;Gag reflex;Pupillary light reflex;Scratch reflex
The protagonist in the game "Cave Story" is named;Entertainment: Video Games;Quote;Kazuma;Curly;Arthur
In The Lord of the Rings: The Fellowship of the Ring, which one of the following characters from the book was left out of the film?;Entertainment: Film;Tom Bombadil;Strider;Barliman Butterbur;Celeborn
What is the capital of British Columbia, Canada?;Geography;Victoria;Vancouver;Hope;Kelowna
In The Elder Scrolls V: Skyrim, who is the jester in the dark brotherhood?;Entertainment: Video Games;Cicero;Lucien Lachance;Archimedes;Astrid
The LS1 engine is how many cubic inches?;Vehicles;346;350;355;360
Laserjet and inkjet printers are both examples of what type of printer?;Science: Computers;Non-impact printer;Impact printer;Daisywheel printer;Dot matrix printer
Which of these is not a wonder weapon in "Call Of Duty: Zombies"?;Entertainment: Video Games;R115 Resonator;GKZ-45 Mk3;Ray Gun;Scavenger
Who developed the 2016 farming RPG "Stardew Valley"?;Entertainment: Video Games;Eric Barone;Daisuke Amaya;Jasper Byrne;Lucas Pope
How long is an IPv6 address?;Science: Computers;128 bits;32 bits;64 bits;128 bytes
What is the official name of the star located closest to the North Celestial Pole?;Science & Nature;Polaris;Eridanus;Gamma Cephei;Iota Cephei
How many times did Martina Navratilova win the Wimbledon Singles Championship?;Sports;Nine;Ten;Seven;Eight
In the 1976 film 'Taxi Driver', how many guns did Travis buy from the salesman?;Entertainment: Film;4;2;6;1
On a London Underground map, what colour is the Circle Line?;Geography;Yellow;Red;Blue;Green
The Principality of Sealand is an unrecognized micronation off the coast of what country?;Geography;The United Kingdom;Japan;Austrailia;Argentina
What is the hottest planet in the Solar System?;Science & Nature;Venus;Mars;Mercury;Jupiter
What colour is the circle on the Japanese flag?;Geography;Red;White;Yellow;Black
What age was King Henry V when he died?;History;36;62;87;73
Who voices Max Payne in the 2001 game "Max Payne"?;Entertainment: Video Games;James McCaffrey;Sam Lake;Troy Baker;Hideo Kojima
How many points is the Z tile worth in Scrabble?;Entertainment: Board Games;10;8;5;6
What year was "JoJo's Bizarre Adventure: Phantom Blood" first released?;Entertainment: Japanese Anime & Manga;1987;2013;1983;1995
Which of these are the name of a famous marker brand?;Art;Copic;Dopix;Cofix;Marx
In "The Melancholy of Haruhi Suzumiya" series, the SOS Brigade club leader is unknowingly treated as a(n) __ by her peers.;Entertainment: Japanese Anime & Manga;God;Alien;Time Traveler;Esper
In the Panic! At the Disco's song "Nothern Downpour", which lyric follows 'I know the world's a broken bone'.;Entertainment: Music;"So melt your headaches call it home";"So sing your song until you're home";"So let them know they're on their own";"So start a fire in their cold stone"
Which of the following Grand Slam tennis tournaments occurs LAST?;Sports;US Open;French Open;Wimbledon;Australian Open
"Gimmick!" is a Japanese Famicom game that uses a sound chip expansion in the cartridge. What is it called?;Entertainment: Video Games;FME-7;VRC7;VRC6;MMC5
What color is the "Ex" in FedEx Ground?;General Knowledge;Green;Red;Light Blue;Orange
When was the video game publisher "Ubisoft" founded ?;Entertainment: Video Games;March 1986;April 1990;June 2001;August 1956
In "Call Of Duty: Zombies", what does the game traditionally reward you for completing a boss round?;Entertainment: Video Games;Max Ammo;A Pack-A-Punched gun;Death Machine;Monkey Bombs
What is the name given to layer 4 of the Open Systems Interconnection (ISO) model?;Science: Computers;Transport;Session;Data link;Network
In "Resident Evil 2", what is Leon Kennedy's middle name?;Entertainment: Video Games;Scott;Shaun;Simon;Sam
Where does "The Legend of Zelda: Majora's Mask" take place?;Entertainment: Video Games;Termina;Hyrule;Gysahl;Besaid
In "ALF", what was ALF's real name?;Entertainment: Film;Gordon Shumway;Gordon Milipp;Gordon Foster;Gordon von Gam
Which song made by MAN WITH A MISSION was used as the opening for the anime "Log Horizon"?;Entertainment: Music;"Database";"Dead End in Tokyo";"Raise Your Flag";"Out of Control"
The first half-hour CGI cartoon, ReBoot, aired on which year?;Entertainment: Television;1994;1993;1998;1999
What did Alfred Hitchcock use as blood in the film "Psycho"? ;Entertainment: Film;Chocolate syrup;Ketchup;Red food coloring;Maple syrup
This movie contains the quote, "I feel the need ... the need for speed!";Entertainment: Film;Top Gun;Days of Thunder;The Color of Money;Cocktail
All of the following are towns\/villages in the Pacific Island nation of Kiribati EXCEPT:;Geography;Urutora;Rungata;London;Washington
How many countries does the United States share a land border with?;Geography;2;1;3;4
What is the name of the 2016 mixtape released by Venezuelan electronic producer Arca?;Entertainment: Music;Entra&ntilde;as;&amp;&amp;&amp;&amp;&amp;&amp;;Sheep;Xen
What is the French word for "hat"?;General Knowledge;Chapeau;Bonnet; écharpe; Casque
How many times was Albert Einstein married in his lifetime?;History;Twice;Five;Thrice;Once
Where is the fast food chain "Panda Express" headquartered?;Geography;Rosemead, California;Sacramento, California;Fresno, California;San Diego, California
What is the last letter of the Greek alphabet?;General Knowledge;Omega;Mu;Epsilon;Kappa
Who invented the "Flying Shuttle" in 1738; one of the key developments in the industrialization of weaving?;History;John Kay;James Hargreaves;Richard Arkwright;John Deere
What is the name of the "Flash" and "Arrow" spinoff featuring a team of characters that have appeared on both shows?;Entertainment: Television;Legends of Tomorrow;Heroes of Tomorrow;The Justice Society of America;The Justice Society
What does the term GPU stand for?;Science: Computers;Graphics Processing Unit;Gaming Processor Unit;Graphite Producing Unit;Graphical Proprietary Unit
Which of these games was NOT a Nintendo Switch launch title in the United States? ;Entertainment: Video Games;Voez;Just Dance 2017;Snipperclips;Fast RMX
In the "Archie" comics, who was Jughead's first girlfriend?;Entertainment: Comics;Joani;Ethel;Debbi;Margret
Which famous rapper is featured in Jack &Uuml; (Skrillex and Diplo)'s 2015 single called "Febreze"?;Entertainment: Music;2 Chainz;Kendrick Lamar;Future;Fatman Scoop
Which of these bands was a featuring artist in Compton rapper Kendrick Lamar's 2017 album, "DAMN."?;Entertainment: Music;U2;Radiohead;Coldplay;Bon Jovi
What is the collective noun for a group of crows?;Animals;Murder;Pack;Gaggle;Herd
In Telltale Games' "The Walking Dead: Season One" what is the name of Clementine's father?;Entertainment: Video Games;Ed;Charles;Lee;Walter
Which country has the most Trappist breweries?;General Knowledge;Belgium;Netherlands;France;USA
When did the Battle of the Bulge end?;History;January 25, 1945;August 6, 1945;December 7, 1941;December 16, 1944
Which car manufacturer won the 2016 24 Hours of Le Mans?;Sports;Porsche;Toyota;Audi;Ferrari
What is the correct term for the metal object in between the CPU and the CPU fan within a computer system?;Science: Computers;Heat Sink;CPU Vent;Temperature Decipator;Heat Vent
Which American author was also a budding travel writer and wrote of his adventures with his dog Charley?;Entertainment: Books;John Steinbeck;F. Scott Fitzgerald;Ernest Hemingway;William Faulkner
What is the capital of the US State of New York?;Geography;Albany;Buffalo;New York;Rochester
What is the real name of the Scout in "Team Fortress 2"?;Entertainment: Video Games;Jeremy;Lance;Walter;John
In the "Ace Attorney" series, what is the relationship between Apollo Justice and Trucy Wright?;Entertainment: Video Games;They're half-siblings;They're co-workers;They're friends;They're both attorneys
What was the name of the German offensive operation in October 1941 to take Moscow before winter?;History;Operation Typhoon;Operation Sunflower;Operation Barbarossa;Case Blue
Which of these characters live in a pineapple under the sea in the cartoon "SpongeBob SquarePants".;Entertainment: Cartoon & Animations;SpongeBob SquarePants ;Patrick Star;Squidward Tentacles;Mr. Krabs
If someone said "you are olid", what would they mean?;General Knowledge;You smell extremely unpleasant.;You are out of shape\/weak.;Your appearance is repulsive.;You are incomprehensible\/an idiot.
In Magic: The Gathering, what term for blocking was established in the Portal set?;Entertainment: Board Games;Intercepting;Blocking;Resisting;Shielding
What is the name of Eragon's dragon in "Eragon"?;Entertainment: Books;Saphira;Glaedr;Thorn;Arya
What is the name of Jontron's parrot?;Celebrities;Jacques;Jak;John;Jaques
Which M83 album is the song "Midnight City" featured in?;Entertainment: Music;Hurry Up, We're Dreaming;Saturdays = Youth;Before the Dawn Heals Us;Junk
Which of the following commercial vehicles from Grand Theft Auto IV did NOT reappear in Grand Theft Auto V?;Entertainment: Video Games;Steed;Mule;Benson;Pony
What is the name of the comic about a young boy, and a tiger who is actually a stuffed animal?;Entertainment: Comics;Calvin and Hobbes;Winnie the Pooh;Albert and Pogo;Peanuts
What was the first James Bond film?;Entertainment: Film;Dr. No;Goldfinger;From Russia With Love;Thunderball
In vanilla Minecraft, which of the following cannot be made into a block?;Entertainment: Video Games;Charcoal;Coal;Wheat;String
In what year was Hearthstone released?;Entertainment: Video Games;2014;2011;2013;2012
What is the name of the formerly rich fishing grounds off the island of Newfoundland, Canada?;Geography;Grand Banks;Great Barrier Reef;Mariana Trench;Hudson Bay
What is the name of the 4-armed Chaos Witch from the 2016 video game "Battleborn"?;Entertainment: Video Games;Orendi;Orendoo;Oranda;Randy
In "One Piece", what does "the Pirate King" mean to the captain of the Straw Hat Pirates?;Entertainment: Japanese Anime & Manga;Freedom;Promise;Adventure;Friendship
Toby Fox's "Megalovania" was first used where?;Entertainment: Video Games;Radiation's Earthbound Halloween Hack;Homestuck: [S] Wake;Undertale;Mother: Cognitive Dissonance
What is the name of the game developer who created "Call Of Duty: Zombies"?;Entertainment: Video Games;Treyarch;Sledgehammer Games;Infinity Ward;Naughty Dog
How many games are there in the "Colony Wars" series for the PlayStation?;Entertainment: Video Games;3;2;4;5
What is the species of the "Predator" in the 1987 movie "Predator"?;Entertainment: Film;Yautja;Xenomorph;Praetorian;Phocrex
In "Puella Magi Madoka Magica", what is the first name of Madoka's younger brother?;Entertainment: Japanese Anime & Manga;Tatsuya;Montoya;Tomohisa;Minato
Why were only only 300,000 copies of Uniracers were produced?;Entertainment: Video Games;DMA Designs was sued by Pixar, preventing more copies from being produced;There was a disagreement between DMA Designs and Nintendo;It didn't sell well due to poor review scores;No public information is available
Which Pokémon and it's evolutions were banned from appearing in a main role after the Episode 38 Incident?;Entertainment: Japanese Anime & Manga;The Porygon Line;The Pikachu Line;The Elekid Line;The Magby Line
What is the name of a rabbit's abode?;Animals;Burrow;Nest;Den;Dray
Which of the following movies was not based on a novel by Stephen King? ;Entertainment: Film;The Thing;Carrie;Misery;The Green Mile
Who is the protagonist in the game "The Walking Dead: Season One"?;Entertainment: Video Games;Lee Everett;Clementine;Kenny;Rick Grimes
Which of his six wives was Henry VIII married to the longest?;History;Catherine of Aragon;Anne Boleyn;Jane Seymour;Catherine Parr
The main protagonist of the fourth part of JoJo's Bizarre Adventure is which of the following?;Entertainment: Japanese Anime & Manga;Josuke Higashikata;Yoshikage kira;Koichi Hirose;Joey JoJo
Who was the main antagonist of Max Payne 3 (2012)?;Entertainment: Video Games;Victor Branco;&Aacute;lvaro Neves;Armando Becker;Milo Rego
Which Greek &amp; Roman god was known as the god of music, truth and prophecy, healing, the sun and light, plague, poetry, and more?;Mythology;Apollo;Aphrodite;Artemis;Athena
In Chemistry, how many isomers does Butanol (C4H9OH) have?;Science & Nature;4;3;5;6
In the animated series RWBY, what is the name of the weapon used by Weiss Schnee?;Entertainment: Cartoon & Animations;Myrtenaster;Gambol Shroud;Crescent Rose;Ember Celica
Which female player won the gold medal of table tennis singles in 2016 Olympics Games?;Sports;DING Ning (China);LI Xiaoxia (China);Ai FUKUHARA (Japan);Song KIM (North Korea)
Which of the following characters is NOT a female marriage candidate in the game Stardew Valley?;Entertainment: Video Games;Caroline;Abigail;Haley;Leah
In the 1999 movie Fight Club, which of these is not a rule of the "fight club"?;Entertainment: Film;Always wear a shirt;You do not talk about FIGHT CLUB;Only two guys to a fight;Fights will go on as long as they have to
What does LASER stand for?;Science & Nature;Light amplification by stimulated emission of radiation;Lite analysing by stereo ecorazer;Light amplifier by standby energy of radio;Life antimatter by standing entry of range
Which of the General Mills Corporation's monster cereals was the last to be released in the 1970's?;General Knowledge;Fruit Brute;Count Chocula;Franken Berry;Boo-Berry
What does a milliner make and sell?;General Knowledge;Hats;Shoes;Belts;Shirts
The main six year old protagonist in Calvin and Hobbes is named after what theologian?;Entertainment: Comics;John Calvin;Calvin Klein;Calvin Coolidge;Phillip Calvin McGraw
Which modern country is known as "The Graveyard of Empires"?;History;Afghanistan;China;Iraq;Russia
From which country does the piano originate?;Entertainment: Music;Italy;Germany;Austria;France
Which car manufacturer won the 2017 24 Hours of Le Mans?;Sports;Porsche;Toyota;Audi;Chevrolet
Which of these is a colony of polyps and not a jellyfish?;Animals;Portuguese Man-of-War;Sea Wasp;Irukandji;Sea Nettle
Who composed the soundtrack for the game VVVVVV?;Entertainment: Video Games;Magnus P&aring;lsson;Terry Cavanagh;Danny Baranowsky;Joel Zimmerman
Which of the following is not another name for the eggplant?;General Knowledge;Potimarron;Brinjal;Guinea Squash;Melongene
Gibraltar, located just south of the Iberian peninsula, is a territory of which West Europe country?;Geography;United Kingdom;Spain;Portugal;France
What is the scientific name for the "Polar Bear"?;Animals;Ursus Maritimus;Polar Bear;Ursus Spelaeus;Ursus Arctos
What scientific suborder does the family Hyaenidae belong to?;Animals;Feliformia;Haplorhini;Caniformia;Ciconiiformes
Which of these animals is NOT a lizard?;Animals;Tuatara;Komodo Dragon;Gila Monster;Green Iguana
Which country has three capital cities?;Geography;South Africa;Somalia;China;United Kingdom
Which country is the home of the largest Japanese population outside of Japan?;Geography;Brazil;China;Russia;The United States
In the title of the game "Luigi's Mansion", what is the only letter to not appear with a pair of eyes in it?;Entertainment: Video Games;s;n;i;m
What was the original name of New York City?;History;New Amsterdam;New London;New Paris;New Rome
Which artist composed the original soundtrack for "Watch Dogs 2"?;Entertainment: Video Games;Hudson Mohawke;Rustie;Machinedrum;Flying Lotus
The dish Fugu, is made from what family of fish?;Animals;Pufferfish;Bass;Salmon;Mackerel
What were the first two blocks in "Minecraft"?;Entertainment: Video Games;Grass and Cobblestone;Grass and Stone;Crafting Table and Cobblestone;Cobblestone and Stone
In the novel 1984, written by George Orwell, what is the name of the totalitarian regime that controls Oceania?;Entertainment: Books;INGSOC;Neo-Bolshevism;Obliteration of the Self;Earth Alliance
In the "Pikmin" games, which of the following pikmin colors lacks it's own "Onion" nest?;Entertainment: Video Games;Purple;Winged;Blue;Rock
What are tiny Thwomps called in Super Mario World?;Entertainment: Video Games;Thwimps;Little Thwomp;Mini Thwomp;Tiny Tims
Which church's interior in Vatican City was designed in 1503 by renaissance architects including Bramante, Michelangelo and Bernini?;General Knowledge;St. Peter's Basilica;Catania Cathedral;St. Mark&rsquo;s Basilica;The Duomo of Florence
What album did Gorillaz release in 2017?;Entertainment: Music;Humanz;Plastic Beach;The Fall;Demon Days
Who is the author of the series "Malazan Book of the Fallen"?;Entertainment: Books;Steven Erikson;Ian Cameron Esslemont;George R. R. Martin;J. R. R. Tolkien
What disease crippled President Franklin D. Roosevelt and led him to help the nation find a cure? ;History;Polio;Cancer;Meningitis;HIV
What is the name of your team in Star Wars: Republic Commando?;Entertainment: Video Games;Delta Squad;The Commandos;Bravo Six;Vader's Fist
Under what pseudonym did Stephen King publish five novels between 1977 and 1984?;Entertainment: Books;Richard Bachman;J. D. Robb;Mark Twain;Lewis Carroll
What year did the game "Overwatch" enter closed beta?;Entertainment: Video Games;2015;2013;2011;2016
Which of the following characters were considered for inclusion in Super Smash Bros. Melee?;Entertainment: Video Games;Lucas;Mega Man;Meta Knight;Diddy Kong
What is the name of the final villain in the manga series "Bleach"?;Entertainment: Japanese Anime & Manga;Yhwach;Juha Bach;Yuhabah;Juhabach
Which of these songs does NOT play during the Ruins segments of the 2015 game "Undertale"?;Entertainment: Video Games;Another Medium;Anticipation;Unnecessary Tension;Ruins
In Hitman: Blood Money, what is the name of the target in the mission "Death of a Showman"?;Entertainment: Video Games;Joseph Clarence;The Swing King;Maynard John;Manuel Delgado
What is the name of rocky region that spans most of eastern Canada?;Geography;Canadian Shield;Rocky Mountains;Appalachian Mountains;Himalayas
How many regular Sunken Sea Scrolls are there in "Splatoon"?;Entertainment: Video Games;27;32;30;5
Which of these games was NOT developed by Markus Persson?;Entertainment: Video Games;Dwarf Fortress;Minecraft;Wurm Online;0x10c
What's the first National Park designated in the United States?;Geography;Yellowstone;Sequoia ;Yosemite;Rocky Mountain
In "Highschool DxD", Koneko Toujou is from what race?;Entertainment: Japanese Anime & Manga;Nekomata;Kitsune;Human;Kappa
In what year does Jurassic World open in the "Jurassic Park" universe?;Entertainment: Film;2005;2007;2015;2020
How many years did the Hundred Years' War last?;History;116;100;90;101
Where is the Gluteus Maximus muscle located?;Science & Nature;Butt;Arm;Head;Torso
Which character in the "Animal Crossing" series uses the phrase "zip zoom" when talking to the player?;Entertainment: Video Games;Scoot;Drake;Bill;Mallary
What was the personal nickname of the 40th Governor of the US State Louisiana, Huey Long?;Politics;The Kingfish;The Champ;The Hoot Owl;The Oracle
In Calvin and Hobbes, what is the name of the principal at Calvin's school?;Entertainment: Comics;Mr. Spittle;Mr. Boreman;Mr. Spitling;Mr. Moe
Into which basin does the Jordan River flow into?;Geography;Dead Sea;Aral Sea;Caspian Sea;Salton Sea
How many premier league trophies did Sir Alex Ferguson win during his time at Manchester United?;Sports;13;11;20;22
What name did Tom Hanks give to his volleyball companion in the film `Cast Away`?;Entertainment: Film;Wilson;Friday;Jones;Billy
In what year did "The Big Bang Theory" debut on CBS?;Entertainment: Television;2007;2008;2006;2009
In the Harry Potter universe, what is Cornelius Fudge's middle name?;Entertainment: Books;Oswald;James;Harold;Christopher
By what nickname is Jack Dawkins known in the Charles Dickens novel, 'Oliver Twist'?;Entertainment: Books;The Artful Dodger;Fagin;Bull&rsquo;s-eye;Mr. Fang
Who is the main character in "The Stanley Parable"?;Entertainment: Video Games;Stanley;The Adventure Line;The Narrator;The Boss
"Rollercoaster Tycoon" was programmed mostly entirely in...;Entertainment: Video Games;x86 Assembly;C++;C;ALGOL
Where is the world's oldest still operational space launch facility located?;Geography;Kazakhstan;Russia;Iran;United States
In Danganronpa: Trigger Happy Havoc, what is the protagonist's name?;Entertainment: Video Games;Makoto Naegi;Hajime Hinata;Nagito Komaeda;Komaru Naegi
Which year was the album "Floral Shoppe" by Macintosh Plus released?;Entertainment: Music;2011;2014;2013;2012
What was the name of the the first episode of Doctor Who to air in 1963?;Entertainment: Television;An Unearthly Child;The Daleks;The Aztecs;The Edge of Destruction
Volkswagen's legendary VR6 engine has cylinders positioned at what degree angle?;Vehicles;15 Degree;30 Degree;45 Degree;90 Degree
